<clocktree
  xmlns:xsi="http://www.w3.org/2001/XMLSchema-instance"
  xsi:noNamespaceSchemaLocation="http://www.chibios.org/xml/schema/clocks/clocktree.xsd">
  <settings>
    <prefixes clock_points="CLK_" macros="STM32_" cfgs="STM32_CFG_" />
    <suffixes values="_VALUE" bits="_BITS" selector="_SEL" enable="_ENABLE" />
    <mode macro="STM32_CFG_CLOCK_DYNAMIC" default="FALSE" />
  </settings>
  <clocks>
    <clock point="NONE" enable="never" dynamic="no">
      <description>pseudo-clock for disabled sources</description>
      <source frequency="0U" />
    </clock>
    <clock point="HSI16" enable="manual" dynamic="yes">
      <description>16MHz high speed internal oscillator</description>
      <bits enabled="(RCC_CR_HSIKERON | RCC_CR_HSION)" disabled="0U" />
      <source frequency="16000000U" />
    </clock>
    <clock point="HSI48" enable="manual" dynamic="yes">
      <description>48MHz high speed internal oscillator</description>
      <bits enabled="RCC_CRRCR_HSI48ON" disabled="0U" />
      <source frequency="48000000U" />
    </clock>
    <clock point="HSE" enable="manual" dynamic="yes">
      <description>high frequency external oscillator</description>
      <bits enabled="RCC_CR_HSEON" disabled="0U" />
      <source frequency="STM32_HSECLK" />
    </clock>
    <clock point="LSE" enable="manual" dynamic="no">
      <description>low frequency external oscillator</description>
      <bits enabled="RCC_BDCR_LSEON" disabled="0U" />
      <source frequency="STM32_LSECLK" />
    </clock>
    <clock point="LSI" enable="manual" dynamic="no">
      <description>low frequency internal oscillator</description>
      <bits enabled="RCC_CSR_LSION" disabled="0U" />
      <source frequency="32768U" />
    </clock>
    <clock point="PLLIN" enable="auto" dynamic="no">
      <description>PLL input</description>
      <mux name="PLLSRC">
        <input point="NONE">
          <bits value="STM32_PLLSRC_NOCLOCK" />
        </input>
        <input point="HSI16" default="yes">
          <bits value="STM32_PLLSRC_HSI16" />
        </input>
        <input point="HSE">
          <bits value="STM32_PLLSRC_HSE" />
        </input>
      </mux>
    </clock>
    <clock point="PLLREF" enable="auto" dynamic="no">
      <description>PLL reference</description>
      <divider name="PLLM" input="PLLIN">
        <value min="1" max="16" default="4">
          <bits value="((%N% - 1U) &lt;&lt; RCC_PLLCFGR_PLLM_Pos)" />
        </value>
      </divider>
    </clock>
     <clock point="PLLVCO" enable="auto" dynamic="no">
      <description>PLL VCO</description>
      <multiplier name="PLLN" input="PLLREF">
        <value min="8" max="127" default="84">
          <bits value="(%N% &lt;&lt; RCC_PLLCFGR_PLLN_Pos)" />
        </value>
      </multiplier>
    </clock>
     <clock point="PLLP" enable="auto" dynamic="yes">
      <description>PLL P output</description>
      <bits enabled="RCC_PLLCFGR_PLLPEN" disabled="0U" />
      <divider name="PLLP" input="PLLVCO">
        <value min="2" max="31" default="7">
          <bits value="(%N% &lt;&lt; RCC_PLLCFGR_PLLPDIV_Pos)" />
        </value>
      </divider>
    </clock>
    <clock point="PLLQ" enable="auto" dynamic="yes">
      <description>PLL Q output</description>
      <bits enabled="RCC_PLLCFGR_PLLQEN" disabled="0U" />
      <divider name="PLLQ" input="PLLVCO">
        <set values="2 4 6 8" default="8">
          <bits value="(((%N% / 2U) - 1U) &lt;&lt; RCC_PLLCFGR_PLLQ_Pos)" />
        </set>
      </divider>
    </clock>
    <clock point="PLLR" enable="auto" dynamic="yes">
     <description>PLL R output</description>
      <bits enabled="RCC_PLLCFGR_PLLREN" disabled="0U" />
      <divider name="PLLR" input="PLLVCO">
        <set values="2 4 6 8" default="2">
          <bits value="(((%N% / 2U) - 1U) &lt;&lt; RCC_PLLCFGR_PLLR_Pos)" />
        </set>
      </divider>
    </clock>
    <clock point="SYSCLK" enable="always" dynamic="yes">
      <description>system clock</description>
      <mux name="SW">
        <input point="HSI16">
          <bits value="STM32_SW_HSI16" />
        </input>
        <input point="HSE">
          <bits value="STM32_SW_HSE" />
        </input>
        <input point="PLLR" default="yes">
          <bits value="STM32_SW_PLLRCLK" />
        </input>
      </mux>
    </clock>
    <clock point="HCLK" enable="always" dynamic="yes">
     <description>AHB</description>
      <divider name="HPRE" input="SYSCLK">
        <choices>
          <choice item="DIV1" value="1"><bits value="STM32_HPRE_DIV1" /></choice>
          <choice item="DIV2" value="2"><bits value="STM32_HPRE_DIV2" /></choice>
          <choice item="DIV4" value="4"><bits value="STM32_HPRE_DIV4" /></choice>
          <choice item="DIV8" value="8"><bits value="STM32_HPRE_DIV8" /></choice>
          <choice item="DIV16" value="16"><bits value="STM32_HPRE_DIV16" /></choice>
          <choice item="DIV64" value="64"><bits value="STM32_HPRE_DIV64" /></choice>
          <choice item="DIV128" value="128"><bits value="STM32_HPRE_DIV128" /></choice>
          <choice item="DIV256" value="256"><bits value="STM32_HPRE_DIV256" /></choice>
          <choice item="DIV512" value="512"><bits value="STM32_HPRE_DIV512" /></choice>
        </choices>
      </divider>
    </clock>
    <clock point="PCLK1" enable="always" dynamic="yes">
     <description>APB1</description>
      <divider name="PPRE1" input="HCLK">
        <choices default="2">
          <choice item="DIV1" value="1"><bits value="STM32_PPRE1_DIV1" /></choice>
          <choice item="DIV2" value="2"><bits value="STM32_PPRE1_DIV2" /></choice>
          <choice item="DIV4" value="4"><bits value="STM32_PPRE1_DIV4" /></choice>
          <choice item="DIV8" value="8"><bits value="STM32_PPRE1_DIV8" /></choice>
          <choice item="DIV16" value="16"><bits value="STM32_PPRE1_DIV16" /></choice>
        </choices>
      </divider>
    </clock>
    <clock point="PCLK2" enable="always" dynamic="yes">
     <description>APB2</description>
      <divider name="PPRE2" input="HCLK">
        <choices>
          <choice item="DIV1" value="1"><bits value="STM32_PPRE2_DIV1" /></choice>
          <choice item="DIV2" value="2"><bits value="STM32_PPRE2_DIV2" /></choice>
          <choice item="DIV4" value="4"><bits value="STM32_PPRE2_DIV4" /></choice>
          <choice item="DIV8" value="8"><bits value="STM32_PPRE2_DIV8" /></choice>
          <choice item="DIV16" value="16"><bits value="STM32_PPRE2_DIV16" /></choice>
        </choices>
      </divider>
    </clock>
    <clock point="PCLK1TIM" enable="always" dynamic="yes">
      <description>APB1 timer clock</description>
      <source frequency="((STM32_CFG_PCLK1_VALUE == 1) ? STM32_PCLK1_FREQ : (STM32_PCLK1_FREQ * 2U))" />
    </clock>
    <clock point="PCLK2TIM" enable="always" dynamic="yes">
      <description>APB2 timer clock</description>
      <source frequency="((STM32_CFG_PCLK2_VALUE == 1) ? STM32_PCLK2_FREQ : (STM32_PCLK2_FREQ * 2U))" />
    </clock>
    <clock point="CKIN" enable="always" dynamic="no">
      <description>external audio clock input</description>
      <source frequency="0U" />
    </clock>
    <clock point="HSEDIV" enable="always" dynamic="no">
      <description>HSE divided clock</description>
      <source frequency="(STM32_HSE_FREQ / 32U)" />
    </clock>
    <clock point="MCODIV" enable="always" dynamic="no">
      <description>MCO source before prescaler</description>
      <mux name="MCOSEL">
        <input point="NONE" default="yes"><bits value="STM32_MCOSEL_NOCLOCK" /></input>
        <input point="SYSCLK"><bits value="STM32_MCOSEL_SYSCLK" /></input>
        <input point="HSI16"><bits value="STM32_MCOSEL_HSI16" /></input>
        <input point="HSE"><bits value="STM32_MCOSEL_HSE" /></input>
        <input point="PLLR"><bits value="STM32_MCOSEL_PLLRCLK" /></input>
        <input point="LSI"><bits value="STM32_MCOSEL_LSI" /></input>
        <input point="LSE"><bits value="STM32_MCOSEL_LSE" /></input>
        <input point="HSI48"><bits value="STM32_MCOSEL_HSI48" /></input>
      </mux>
    </clock>
    <clock point="MCO" enable="always" dynamic="yes">
      <description>MCO output pin</description>
      <divider name="MCOPRE" input="MCODIV">
        <choices>
          <choice item="DIV1" value="1"><bits value="STM32_MCOPRE_DIV1" /></choice>
          <choice item="DIV2" value="2"><bits value="STM32_MCOPRE_DIV2" /></choice>
          <choice item="DIV4" value="4"><bits value="STM32_MCOPRE_DIV4" /></choice>
          <choice item="DIV8" value="8"><bits value="STM32_MCOPRE_DIV8" /></choice>
          <choice item="DIV16" value="16"><bits value="STM32_MCOPRE_DIV16" /></choice>
        </choices>
      </divider>
    </clock>
    <clock point="LSCO" enable="always" dynamic="no">
      <description>LSCO output pin</description>
      <mux name="LSCOSEL">
        <input point="NONE" default="yes"><bits value="STM32_LSCOSEL_NOCLOCK" /></input>
        <input point="LSI"><bits value="STM32_LSCOSEL_LSI" /></input>
        <input point="LSE"><bits value="STM32_LSCOSEL_LSE" /></input>
      </mux>
    </clock>
    <clock point="RTC" enable="always" dynamic="no">
      <description>RTC</description>
      <mux name="RTCSEL">
        <input point="NONE" default="yes"><bits value="STM32_RTCSEL_NOCLOCK" /></input>
        <input point="LSE"><bits value="STM32_RTCSEL_LSE" /></input>
        <input point="LSI"><bits value="STM32_RTCSEL_LSI" /></input>
        <input point="HSEDIV"><bits value="STM32_RTCSEL_HSEDIV" /></input>
      </mux>
    </clock>
    <clock point="USART1" enable="always" dynamic="no">
      <description>USART1</description>
      <mux name="USART1SEL">
        <input point="PCLK2"><bits value="STM32_USART1SEL_PCLK2" /></input>
        <input point="SYSCLK" default="yes"><bits value="STM32_USART1SEL_SYSCLK" /></input>
        <input point="HSI16"><bits value="STM32_USART1SEL_HSI16" /></input>
        <input point="LSE"><bits value="STM32_USART1SEL_LSE" /></input>
      </mux>
    </clock>